    1 0.000000000 169.254.144.1 → 169.254.144.9 TCP 40 61845 → 9090 [SYN] Seq=0 Win=64000 Len=0
    2 0.000785354 169.254.144.9 → 169.254.144.1 TCP 40 9090 → 61845 [SYN, ACK] Seq=0 Ack=1 Win=64000 Len=0
    3 0.001692138 169.254.144.1 → 169.254.144.9 TCP 40 61845 → 9090 [ACK] Seq=1 Ack=1 Win=64000 Len=0


dereck@cs144_vm:/mnt/hgfs/shareFolder/sponge/build$ sudo tshark -Pw /tmp/debug.raw -i tun144
[sudo] password for dereck: 
Running as user "root" and group "root". This could be dangerous.
Capturing on 'tun144'
    1 0.000000000 169.254.144.1 → 169.254.144.9 TCP 40 9099 → 9090 [SYN] Seq=0 Win=0 Len=0
    2 0.000787113 169.254.144.9 → 169.254.144.1 TCP 40 9090 → 9099 [SYN, ACK] Seq=0 Ack=1 Win=64000 Len=0
    3 0.001815205 169.254.144.1 → 169.254.144.9 TCP 40 9099 → 9090 [ACK] Seq=1 Ack=1 Win=64000 Len=0
    4 7.346515791 169.254.144.9 → 169.254.144.1 TCP 43 9090 → 9099 [ACK] Seq=1 Ack=1 Win=64000 Len=3
    5 7.346982279 169.254.144.1 → 169.254.144.9 TCP 40 9099 → 9090 [ACK] Seq=1 Ack=4 Win=63997 Len=0
    6 23.888084918 169.254.144.1 → 169.254.144.9 TCP 45 9099 → 9090 [ACK] Seq=1 Ack=4 Win=64000 Len=5
    7 23.888596702 169.254.144.9 → 169.254.144.1 TCP 40 9090 → 9099 [ACK] Seq=4 Ack=6 Win=63995 Len=0



